lon,lat,name,address,pname,cityname,business_area,type
103.940952,30.973723,四川省邮政速递物流公司(彭州分公司),南大街461号,四川省,成都市,天彭,生活服务;邮局;邮政速递|公司企业;公司;公司
103.866112,31.046517,圆通速递,隆丰镇隆新路北段199号,四川省,成都市,,生活服务;物流速递;物流速递
103.940107,31.087936,中通速递,葛仙山镇楠杨社区东街99号楠杨加油站上来100米,四川省,成都市,,生活服务;物流速递;物流速递
103.972600,30.996191,中通速递,金华东路311号附近,四川省,成都市,,生活服务;物流速递;物流速递
103.834608,31.158523,圆通速递,通济镇仙溪后街68号,四川省,成都市,,生活服务;物流速递;物流速递
104.111399,30.948383,百世速递,建业中路,四川省,成都市,,生活服务;物流速递;物流速递
103.792666,31.033899,圆通速递,金桂西街12东北60米,四川省,成都市,,生活服务;物流速递;物流速递
103.979308,31.045767,圆通速递,军乐镇政通街12号,四川省,成都市,,生活服务;物流速递;物流速递
103.951111,30.992031,速递易,朝阳中路460号国色天香小区,四川省,成都市,天彭,生活服务;生活服务场所;生活服务场所
103.953363,30.980121,圆通速递(彭州分部),兴盛巷7-9号,四川省,成都市,天彭,生活服务;物流速递;物流速递
103.861127,30.974226,圆通速递(丽春营业部),白鹤路23号,四川省,成都市,,生活服务;物流速递;物流速递
103.938153,30.985132,中通速递(西北市街),西北市街62号附7号,四川省,成都市,天彭,生活服务;物流速递;物流速递
103.829641,31.161759,韵达速递,闽东路,四川省,成都市,,生活服务;物流速递;物流速递
103.932994,30.977547,彭州中通速递,天府西路413号附近,四川省,成都市,,生活服务;物流速递;物流速递
103.757877,31.187445,中通速递(小鱼洞分部),复兴路81号,四川省,成都市,,生活服务;物流速递;物流速递
103.954861,30.957390,极兔速递,金光中路,四川省,成都市,致和街道,生活服务;物流速递;物流速递
103.866950,31.045441,极兔速递,彭白路,四川省,成都市,,生活服务;物流速递;物流速递
103.969122,30.985333,极兔速递,[],四川省,成都市,天彭,生活服务;物流速递;物流速递
104.117131,30.949295,极兔速递,学子路,四川省,成都市,,生活服务;物流速递;物流速递
103.937725,30.985534,极兔速递,[],四川省,成都市,天彭,生活服务;物流速递;物流速递
104.109332,30.948308,韵达快运(蒙阳分部),蒙阳镇农物流小区22栋5单元,四川省,成都市,,生活服务;物流速递;物流速递
103.955074,30.963514,泰便利速递,九江南路与清白江西路交叉路口往西北约50米,四川省,成都市,致和街道,生活服务;物流速递;物流速递
104.117768,30.951540,极兔速递(濛阳网点),濛三北路779号,四川省,成都市,,生活服务;物流速递;物流速递
104.110564,30.957791,中通速递濛阳镇网点,园石街23,四川省,成都市,,生活服务;物流速递;物流速递
103.948701,30.974938,韵达快运,天彭镇朝阳南路320号,四川省,成都市,致和街道,生活服务;物流速递;物流速递
104.126501,30.943513,承宏物流,[],四川省,成都市,,生活服务;物流速递;物流速递
104.127312,30.943609,快点物流,[],四川省,成都市,,生活服务;物流速递;物流速递
104.126645,30.943542,元邦物流,[],四川省,成都市,,生活服务;物流速递;物流速递
103.978225,31.043551,百世快运百世快递,军乐镇乐兴西路27-29,四川省,成都市,,生活服务;物流速递;物流速递
104.104187,31.021309,圆通快递公司,三界镇育才街118号,四川省,成都市,,生活服务;物流速递;物流速递
104.021176,31.025682,圆通快递公司,升平镇升玉南街139号,四川省,成都市,,生活服务;物流速递;物流速递
104.037249,30.994041,圆通快递公司,九尺镇上兴街19号,四川省,成都市,,生活服务;物流速递;物流速递
104.004039,31.142805,红岩圆通快递,[],四川省,成都市,,生活服务;物流速递;物流速递
103.925713,30.980463,飞豪物流,天彭街道天人小区东一巷52号,四川省,成都市,,生活服务;物流速递;物流速递
103.904197,30.976963,兰丰物流,天彭镇安彭路谢家社区3组,四川省,成都市,,生活服务;物流速递;物流速递
103.987255,31.091710,中通快递(敖兴街店),敖平镇敖兴街66号,四川省,成都市,敖平镇,生活服务;物流速递;物流速递
103.868715,30.971658,丽春韵达快递,彭温路64号,四川省,成都市,,生活服务;物流速递;物流速递
104.127985,30.926572,诺邦物流,什新路与千佛路交叉路口往西北约50米,四川省,成都市,,生活服务;物流速递;物流速递
103.947239,30.985989,韵达快运(东湖大街便民服务部),红照壁南街122号,四川省,成都市,天彭,生活服务;物流速递;物流速递
103.958489,30.996566,韵达快递(牡丹新城便民分部),天彭镇回龙西路196号,四川省,成都市,,生活服务;物流速递;物流速递
103.872776,30.972585,中通快递(丽春镇),丽春镇丽蓉大道209号邮政储蓄所对面,四川省,成都市,丽春街道,生活服务;物流速递;物流速递
103.940932,30.978468,韵达快递,天彭街道天府西路44号赵氏靓粥旁,四川省,成都市,天彭,生活服务;生活服务场所;生活服务场所
104.116621,30.954507,韵达快递,蒙三北路923号,四川省,成都市,,生活服务;物流速递;物流速递
104.107876,30.959799,成都丰通物流,蒙阳镇凤凰大道78号,四川省,成都市,,生活服务;物流速递;物流速递
104.110047,30.947940,力展物流蒙阳配送中心,濛阳镇农物流小区1期20栋1单元,四川省,成都市,,生活服务;生活服务场所;生活服务场所
104.116268,30.941240,安能物流,四川省彭州市濛阳镇万贯服装产业园A区一号门249号,四川省,成都市,,生活服务;物流速递;物流速递
104.126789,30.943548,宇鑫物流,[],四川省,成都市,,生活服务;物流速递;物流速递
104.127312,30.943609,紫马物流,[],四川省,成都市,,生活服务;物流速递;物流速递
104.113430,30.941073,壹米滴答·金桥物流(蒙阳),物流大道中段附近,四川省,成都市,,生活服务;物流速递;物流速递
104.127151,30.943581,杰缘物流有限公司,[],四川省,成都市,,生活服务;物流速递;物流速递
104.127756,30.943625,西部风物流(濛阳营业部),[],四川省,成都市,,生活服务;物流速递;物流速递
103.957233,30.982043,中国邮政便民服务,[],四川省,成都市,天彭,生活服务;生活服务场所;生活服务场所
103.888541,31.025684,中国邮政便民服务,彭白路,四川省,成都市,,生活服务;生活服务场所;生活服务场所
103.968747,30.990386,中通快运,调露寺东路63号,四川省,成都市,天彭,生活服务;物流速递;物流速递
104.001491,31.163707,中国邮政,湔红路,四川省,成都市,,生活服务;邮局;邮局
103.912251,31.189444,白鹿邮政代办所,水观村森林美地小区,四川省,成都市,,生活服务;邮局;邮局
103.878125,30.975385,中通快运,[],四川省,成都市,,生活服务;物流速递;物流速递
103.957607,30.961970,中通快运,天彭镇青白江东路111号,四川省,成都市,致和,生活服务;物流速递;物流速递
103.970968,30.996136,成都市鸿顺康物流有限责任公司,天彭街道回龙东路270号,四川省,成都市,,生活服务;物流速递;物流速递
103.854063,31.067135,彭州市丹景山镇农村电子商务物流中心,[],四川省,成都市,,生活服务;物流速递;物流速递
103.932607,30.953497,四川诺特冷链物流有限公司,致和镇健康大道198号,四川省,成都市,,生活服务;物流速递;物流速递
103.951125,31.012521,彭州兴博达物流有限公司,锦阳东路了53号,四川省,成都市,,生活服务;物流速递;物流速递
104.121369,30.945720,成都恒昌运通物流有限公司,四川国际农产品交易中心8号出入口对面,四川省,成都市,,生活服务;物流速递;物流速递
103.837047,30.953928,成都巨仓物流有限公司,[],四川省,成都市,,生活服务;物流速递;物流速递
103.948154,30.980423,四川坤特麦斯物流有限公司,[],四川省,成都市,天彭,生活服务;物流速递;物流速递
103.950645,31.014718,成都新正兴物流有限公司,[],四川省,成都市,,生活服务;物流速递;物流速递
103.868114,31.046465,皓晨物流有限公司,隆裕街,四川省,成都市,隆丰,生活服务;物流速递;物流速递
103.961674,31.015602,成都驰伟物流有限公司,[],四川省,成都市,,生活服务;物流速递;物流速递
103.966352,30.990986,成都强昇物流有限公司,牡丹北路东段,四川省,成都市,天彭,生活服务;物流速递;物流速递
104.142172,30.999062,成都北新不锈钢物流有限公司,三界镇袛园村,四川省,成都市,,生活服务;物流速递;物流速递
104.117597,30.936979,中铁物流四川有限公司蒙阳营业部,蒙阳镇蒙兴东路168号,四川省,成都市,,生活服务;物流速递;物流速递
103.939636,30.984046,彭州永莲物流配送有限公司,西大街71附近,四川省,成都市,天彭,生活服务;物流速递;物流速递
104.099577,30.946095,四川瓯锦物流有限公司,蒙阳镇伏龙小区996号12栋二单元,四川省,成都市,,生活服务;物流速递;物流速递
103.945649,30.934538,成都金克星物流有限公司,协和大道香颂园附近协和路129号,四川省,成都市,,生活服务;物流速递;物流速递
103.901351,30.976940,成都市金胜利物流有限公司,天彭镇亚东水泥厂(方圆动物药业对面),四川省,成都市,,生活服务;物流速递;物流速递
104.119118,30.947059,海南鸿运达物流有限公司,蒙三北路539号附近,四川省,成都市,,生活服务;物流速递;物流速递
103.869191,31.045016,兴丰源物流有限公司,隆裕街与兴隆大街交叉路口往北约100米,四川省,成都市,隆丰,生活服务;物流速递;物流速递
103.956874,30.963991,成都腾乐物流有限责任公司,清白江北路,四川省,成都市,致和街道,生活服务;物流速递;物流速递
103.966956,30.986701,云程物流彭州指挥部,汉彭路与105省道交叉口南100米二楼,四川省,成都市,天彭,生活服务;物流速递;物流速递
103.926073,30.979496,峨眉西部风物流,天彭街道天人小区东四巷子77号,四川省,成都市,,生活服务;物流速递;物流速递
104.121882,30.939669,四川领鲜未来物流,濛三北路,四川省,成都市,,生活服务;物流速递;物流速递
104.117485,30.949879,成都欣蓉物流有限公司,学子路71号,四川省,成都市,,生活服务;物流速递;物流速递
103.926855,30.979633,四川君健物流有限公司,天人东四巷27号,四川省,成都市,,生活服务;物流速递;物流速递
103.913093,30.977175,彭州市亚利物流有限公司,天彭镇谢家村(亚东水泥厂旁边),四川省,成都市,,生活服务;物流速递;物流速递
103.864441,31.070032,彭州恒伟嘉润物流有限公司,丹景山东前村赵家巷子,四川省,成都市,,生活服务;物流速递;物流速递
103.966879,30.990592,成都潇顺物流有限公司,天彭镇调露寺西路44号,四川省,成都市,天彭,生活服务;物流速递;物流速递
103.927129,30.980777,余氏东风物流(天人东一巷),天彭镇天人小区天人路19号,四川省,成都市,,生活服务;物流速递;物流速递
103.957829,30.961922,中铁物流集团,致和镇清白江东路103号,四川省,成都市,天彭,生活服务;物流速递;物流速递
103.965936,30.972566,暴风物流,花龙西路1东南60米,四川省,成都市,天彭,生活服务;物流速递;物流速递
103.927414,30.979670,三志物流,[],四川省,成都市,,生活服务;物流速递;物流速递
103.952253,30.950471,速通物流,西河东路166号29栋1号,四川省,成都市,,生活服务;物流速递;物流速递
103.925532,30.980723,宇鑫物流,天人东一巷72号西南方,四川省,成都市,,生活服务;物流速递;物流速递
104.107165,31.024262,佳捷物流,三界北街与西南巷交叉口东南50米,四川省,成都市,,生活服务;物流速递;物流速递
104.097967,30.946764,永辉物流,兴农西路388号,四川省,成都市,,生活服务;物流速递;物流仓储场地
103.948280,30.929167,丹郡湖岸申通快递,致和镇协和路399号10栋附101号,四川省,成都市,,生活服务;物流速递;物流速递
104.107567,31.021791,彭州市三界邮政代办所,三界镇三界南街158号,四川省,成都市,,生活服务;邮局;邮局
104.017009,31.022822,升平邮政代办所,升平镇升玉南街315号,四川省,成都市,,生活服务;邮局;邮局
103.973507,30.948465,菜鸟快递驿站,致斑路,四川省,成都市,,生活服务;物流速递;物流速递
103.874401,30.974204,中国邮政便民服务站(惠民老邻居副食店),丽蓉大道285西北方向180米,四川省,成都市,,生活服务;生活服务场所;生活服务场所
103.945621,30.944108,韵达,贤清南路与护贤西一路交叉路口往南约100米,四川省,成都市,致和,生活服务;物流速递;物流速递
103.931334,30.941211,韵达GROUND,致和镇黑龙泉小区19栋1单元,四川省,成都市,,生活服务;物流速递;物流速递
103.944444,30.978713,中通彭州东南街公司,天彭镇东南市街157号,四川省,成都市,天彭,生活服务;物流速递;物流速递
103.850612,31.065305,中国邮政快邮驿站,[],四川省,成都市,,生活服务;邮局;邮政速递
103.936623,30.992340,中国邮政便民服务站,[],四川省,成都市,天彭,生活服务;生活服务场所;生活服务场所
103.911802,31.189261,中国邮政便民服务站,[],四川省,成都市,,生活服务;生活服务场所;生活服务场所
104.007647,30.967957,中国邮政便民服务站,[],四川省,成都市,,生活服务;生活服务场所;生活服务场所
103.807152,30.966533,中国邮政便民服务站,北桂路,四川省,成都市,,生活服务;生活服务场所;生活服务场所
103.942037,30.986402,彭州市北大街邮政所,北大街109号,四川省,成都市,天彭,生活服务;邮局;邮局
103.936392,30.981473,彭州申通快递有限公司西海北街营业部,西海北街68-70号,四川省,成都市,天彭,生活服务;物流速递;物流速递
103.830551,30.979595,中国邮政村邮站,[],四川省,成都市,,生活服务;邮局;邮政速递
103.856906,30.975764,彭州市三五邮政代办所,丽春镇荷花路5719工厂,四川省,成都市,,生活服务;邮局;邮局
103.837812,30.952760,北君平邮政代办所,丽春镇,四川省,成都市,,生活服务;邮局;邮局
103.949758,30.975517,彭州市朝阳南路邮政所,朝阳南路372号,四川省,成都市,天彭,生活服务;邮局;邮局
103.960012,30.987611,彭州市金彭东路邮政所,金彭东路158号,四川省,成都市,天彭,生活服务;邮局;邮局
103.875718,30.973095,彭州市丽春邮政支局,丽春镇丽蓉大道208-210号,四川省,成都市,,生活服务;邮局;邮局
103.851003,31.071899,彭州市九陇邮政支局,丹景山镇南郡西街31号,四川省,成都市,,生活服务;邮局;邮局
103.927022,30.991830,德邦快递彭州营业部,滨河路302-305,四川省,成都市,天彭,生活服务;物流速递;物流速递
103.956803,30.987432,丰巢快递柜(置信·逸都城),天彭街道金彭东路122号置信逸都城逸都中心写字楼百博教育,四川省,成都市,天彭,生活服务;生活服务场所;生活服务场所
103.935945,30.939698,荣鑫顺物流(彭州)办事处,南部新城黑龙泉小区47-7-101,四川省,成都市,,生活服务;物流速递;物流速递
103.860198,30.974420,德邦快递取货点,丽春镇荷花路144号,四川省,成都市,,生活服务;生活服务场所;生活服务场所
103.918068,30.989589,京东物流(成都天彭营业部),天彭镇白马社区12栋4单元,四川省,成都市,,生活服务;物流速递;物流速递
103.949936,30.979136,吉泰物流(四川分公司),新民东街6号-附8号附近,四川省,成都市,天彭,生活服务;物流速递;物流速递
103.866150,31.048268,东京物流(成都隆丰站),隆裕街,四川省,成都市,,生活服务;物流速递;物流速递
103.943845,30.975305,申通快递南门营业部,南河东街30附近,四川省,成都市,致和街道,生活服务;物流速递;物流速递
103.926446,30.979727,力展物流(天人中路),天人东四巷46-50号,四川省,成都市,,生活服务;物流速递;物流速递
103.926048,30.979622,佳明物流(彭州办事处),天人东三巷与天人中路交叉口西50米,四川省,成都市,,生活服务;物流速递;物流速递
103.757985,31.187351,中通快递小鱼洞镇自取点,小鱼洞镇丙人街27号,四川省,成都市,,生活服务;物流速递;物流速递
103.935193,30.985177,彭州申通快递有限公司(西门分部),翠湖东路83附近,四川省,成都市,天彭,生活服务;物流速递;物流速递
103.952182,30.986473,彭州申通快递有限公司(东门分部),东升街137附近,四川省,成都市,天彭,生活服务;物流速递;物流速递
103.956502,30.961536,彭州市京东快运集配站,金彭故径街229号,四川省,成都市,致和,生活服务;物流速递;物流速递
103.932084,30.952912,国药集团四川医学检验有限公司物流中心,长寿中路,四川省,成都市,,生活服务;物流速递;物流速递
103.850604,31.065466,丹景山镇中通申通快递,丹寿苑小区二栋附103-104,四川省,成都市,,生活服务;物流速递;物流速递
104.125257,30.939632,彭州舞东风农产品物流中心,濛三北路152号,四川省,成都市,,生活服务;物流速递;物流速递
104.006928,31.143351,申通快递代收点(会元街),会元街25号附近,四川省,成都市,,生活服务;物流速递;物流速递
103.864443,31.049845,彭州市隆丰邮政支局,隆丰镇隆裕街301号,四川省,成都市,,生活服务;邮局;邮局
103.780138,31.101083,彭州市磁峰邮政支局,磁峰镇蹯江路80号,四川省,成都市,,生活服务;邮局;邮局
103.988035,31.094180,彭州市敖平邮政局,106省道附近,四川省,成都市,敖平镇,生活服务;邮局;邮局
103.760049,31.191531,彭州市小渔洞邮政代办所,小渔洞镇复兴路280号,四川省,成都市,,生活服务;邮局;邮局
104.117469,30.950744,天地精华农业开发有限责任公司物流配送中心,蒙三北路,四川省,成都市,,生活服务;物流速递;物流仓储场地
104.110383,30.957865,余氏东风物流蒙阳镇营业部,蒙阳镇园石街8号,四川省,成都市,,生活服务;物流速递;物流速递
103.988843,31.096435,余氏东风物流敖平镇服务部,S106(敖红路北段),四川省,成都市,,生活服务;物流速递;物流速递
103.960269,31.131468,彭州市葛仙山邮政代办所,官仓路西50米,四川省,成都市,,生活服务;邮局;邮局
103.780505,31.103187,磁峰申通快递,蟠江路15号,四川省,成都市,,生活服务;物流速递;物流速递
103.834376,31.158503,中通快递公司,通济镇仙溪北街128号,四川省,成都市,,生活服务;物流速递;物流速递
103.917049,30.928707,太平中通快递,致和镇太平社区太平路北段147号,四川省,成都市,,生活服务;物流速递;物流速递
103.970793,30.981440,彭州百世快递,天府东路377号,四川省,成都市,天彭,生活服务;物流速递;物流速递
103.928286,30.952645,德邦快递,健康大道199号湔江大厦楼下,四川省,成都市,,生活服务;物流速递;物流速递
103.926241,30.980576,海风物流(彭州店),天人北街40,四川省,成都市,,生活服务;物流速递;物流速递
104.111215,30.948333,中通快运彭州濛阳营业部,蒙阳镇建业中路198号,四川省,成都市,,生活服务;生活服务场所;生活服务场所
103.958915,30.962159,优速快递,清白江东路38西60米,四川省,成都市,天彭,生活服务;物流速递;物流速递
103.968786,30.989799,顺泰配送,[],四川省,成都市,天彭,生活服务;生活服务场所;生活服务场所
104.113511,30.938501,华厨乐商贸仓储配送中心,蒙阳万贯服装工业园区蒙兴中路145号,四川省,成都市,,生活服务;生活服务场所;生活服务场所
104.124992,30.945148,洋阳配送,[],四川省,成都市,,生活服务;物流速递;物流速递
104.119700,30.937556,成都标果科技有限公司仓储配送中心,濛兴东路与濛三西路交叉路口往东北约50米,四川省,成都市,,生活服务;物流速递;物流速递
103.957964,30.977737,菜鸟驿站(成都彭州恋城公馆店),天彭街道天府东路88号碧美恋城公馆附12号,四川省,成都市,天彭,生活服务;物流速递;物流速递
103.956250,30.989010,菜鸟驿站(成都彭州牡丹西路21号顺风港店),天彭街道牡丹西路21号,四川省,成都市,天彭,生活服务;物流速递;物流速递
104.107840,30.944340,菜鸟驿站(成都蒙阳凤凰大道南段711号店),蒙阳镇凤凰大道南段711号,四川省,成都市,,生活服务;物流速递;物流速递
103.945650,30.940690,菜鸟驿站(成都彭州贤清南路291号店),致和镇贤清南路291号,四川省,成都市,,生活服务;物流速递;物流速递
103.867221,31.047773,顺丰速运,隆裕街与兴府街交叉路口往北约150米,四川省,成都市,,生活服务;物流速递;物流速递
103.947713,30.943923,润怡物流,[],四川省,成都市,致和,生活服务;物流速递;物流速递
103.813573,30.963909,宇超物流,[],四川省,成都市,,生活服务;物流速递;物流速递
104.035613,30.993356,余氏东风物流,观音泉南街114号,四川省,成都市,,生活服务;物流速递;物流速递
103.925787,30.979321,渝诚物流,天彭街道天人小区高铁站对面峰旭超市2楼,四川省,成都市,,生活服务;物流速递;物流速递
103.951250,30.981350,菜鸟驿站(成都彭州润和园后门店),天彭街道新民路242号,四川省,成都市,天彭,生活服务;物流速递;物流速递
103.919821,30.990558,菜鸟驿站(成都彭州天泉小区2栋104号店),天彭街道彭白路天泉小区2栋十单元104号,四川省,成都市,,生活服务;物流速递;物流速递
104.110539,30.956442,四川幸福有菜供应链配送中心,[],四川省,成都市,,生活服务;物流速递;物流速递
103.944145,30.930098,菜鸟驿站(成都彭州丽都府连封北街35号店),天彭街道连封北街35号,四川省,成都市,,生活服务;物流速递;物流速递
103.936637,30.976510,货拉拉LalaPartner一辰汽车销售和服务伙伴,繁江南路378号,四川省,成都市,天彭,生活服务;物流速递;物流速递|汽车销售;汽车销售;汽车销售
103.936583,30.976557,滴滴货运,繁江南路,四川省,成都市,天彭,生活服务;物流速递;物流速递
103.927019,30.980193,宏金龙物流,天人东街1号-11号,四川省,成都市,,生活服务;生活服务场所;生活服务场所
103.911342,31.202530,菜鸟驿站(成都白鹿左岸路店),白鹿镇左岸路136号,四川省,成都市,,生活服务;物流速递;物流速递
103.947100,30.991540,菜鸟驿站(成都彭州团结巷30号店),天彭街道团结巷30号,四川省,成都市,天彭,生活服务;物流速递;物流速递
103.800239,31.035621,彭州市宏顺废品回收站,"利济村九组19号,上庭瓦有限业公司对面",四川省,成都市,,生活服务;物流速递;物流仓储场地
103.986585,30.984094,成都市鸿复剑运输服务有限公司,[],四川省,成都市,,生活服务;生活服务场所;生活服务场所
103.832557,31.161267,顺丰速运,鼓浪屿路与崇德路交叉路口南侧,四川省,成都市,,生活服务;物流速递;物流速递
103.780504,31.101721,顺丰速运,磁峰镇蟠江路63号65号,四川省,成都市,,生活服务;物流速递;物流速递
103.968846,30.984719,新邦物流,天彭街道爱国小区爱国南路311号,四川省,成都市,天彭,生活服务;物流速递;物流速递
103.927543,30.980170,菜鸟驿站(成都彭州天人小区天人路59号店),天彭街道天人路59号,四川省,成都市,,生活服务;物流速递;物流速递
103.933609,30.981429,菜鸟驿站(成都彭州柳河店),天彭街道绣城路南段109号,四川省,成都市,天彭,生活服务;物流速递;物流速递
103.953690,30.987550,菜鸟驿站(成都彭州航利星海湾北区店),天彭街道朝阳中路242号鑫和兴副食,四川省,成都市,天彭,生活服务;物流速递;物流速递
103.943390,30.976050,菜鸟驿站(成都彭州外南街89号店),天彭街道外南街89号,四川省,成都市,天彭,生活服务;物流速递;物流速递
104.103515,30.947010,四川浩润供应链管理服务有限公司,蒙阳镇兴农路228号1栋1号,四川省,成都市,,生活服务;物流速递;物流速递
103.861181,30.968314,天地华宇,彭温路,四川省,成都市,,生活服务;物流速递;物流速递
104.004114,30.962684,直销配送中心,万护路,四川省,成都市,,生活服务;物流速递;物流速递
104.118477,30.937872,昌海商贸仓储中心,[],四川省,成都市,,生活服务;物流速递;物流仓储场地
103.866275,31.048214,京东快递成都隆丰营业部,隆裕街,四川省,成都市,,生活服务;物流速递;物流速递
103.947075,30.943762,龙翔伞四川省配送中心,[],四川省,成都市,,生活服务;生活服务场所;生活服务场所
103.927434,30.979674,壹米滴答,[],四川省,成都市,,生活服务;物流速递;物流速递
103.997420,30.979730,彭州市天彭镇林兵货运部,[],四川省,成都市,,生活服务;物流速递;物流速递
104.035604,30.993372,菜鸟驿站(成都彭州九尺希望路36号店),九尺镇观音泉南街122-124号,四川省,成都市,,生活服务;物流速递;物流速递
103.930635,30.982956,材料配送中心,绣城北路42号附近,四川省,成都市,天彭,生活服务;物流速递;物流速递
103.941190,30.979607,兄弟配送,西南市街273号附近,四川省,成都市,天彭,生活服务;中介机构;中介机构
