lon,lat,name,address,pname,cityname,business_area,type
103.762961,30.436626,成都福记物流有限公司,宝墩镇龙马村9组,四川省,成都市,,生活服务;物流速递;物流速递
103.804638,30.421594,成都洪禾物流有限公司,平岗路159号附近,四川省,成都市,五津街道,生活服务;物流速递;物流速递
103.873276,30.472240,成都津恒物流有限公司,[],四川省,成都市,,生活服务;物流速递;物流速递
103.803308,30.418725,成都川仁物流有限公司,平儒路,四川省,成都市,五津街道,生活服务;物流速递;物流速递
103.914721,30.384898,成都祥悦物流有限公司,普兴街道养正社区养方街22号,四川省,成都市,,生活服务;物流速递;物流速递
103.924243,30.384807,成都广久物流有限公司,邓家寺北路9,四川省,成都市,,公司企业;公司;公司
103.760754,30.394204,成都普诚物流有限公司,安西镇安西村13组19-20号,四川省,成都市,,生活服务;物流速递;物流速递
103.876803,30.471898,成都新诚物流有限公司,花源镇大件路南段天力加油站旁,四川省,成都市,,生活服务;物流速递;物流速递
103.848018,30.431040,成都兴伟物流有限公司,蔡湾街814号,四川省,成都市,,生活服务;生活服务场所;生活服务场所
103.928796,30.388709,嘉民新津物流中心,[],四川省,成都市,,生活服务;物流速递;物流速递
103.890209,30.485076,中铁物流集团花源营业部,白云大道401号附近,四川省,成都市,花源街道,生活服务;物流速递;物流速递
103.783847,30.410493,韵达快递新平代理点,白团路37号,四川省,成都市,新平,生活服务;物流速递;物流速递
103.921576,30.384855,四川省特运物流有限公司,[],四川省,成都市,,生活服务;物流速递;物流速递
103.916122,30.384149,成都市路全物流有限公司,[],四川省,成都市,,生活服务;物流速递;物流速递
103.920324,30.388200,成都市全豪物流有限公司,XA27(大黄路),四川省,成都市,,生活服务;物流速递;物流速递
103.846816,30.428617,成都市九尊物流有限公司,蔡湾村一组88号,四川省,成都市,,生活服务;物流速递;物流速递
103.782675,30.474919,华通诚意物流有限公司,万和物流园,四川省,成都市,,生活服务;物流速递;物流速递
103.793717,30.416697,成都凌氏物流有限公司,黄鹤大道326号,四川省,成都市,,生活服务;物流速递;物流速递
103.744588,30.340739,菜鸟驿站(永商邮政支局611436001店),永商镇和平街31号(永商邮政支局邮政自提点),四川省,成都市,,生活服务;物流速递;物流速递
103.811500,30.422099,成都恒璐物流有限公司,[],四川省,成都市,五津街道,生活服务;物流速递;物流速递
103.915630,30.394182,成都伟经物流园,[],四川省,成都市,,生活服务;物流速递;物流速递
103.901249,30.377158,太古冷链物流(成都)有限公司,金华镇物流园区清云北路,四川省,成都市,,生活服务;物流速递;物流速递
103.924872,30.386449,正企物流有限公司,大黄路北100米,四川省,成都市,,生活服务;物流速递;物流速递
103.924949,30.386564,成都中阳物流有限责任公司,[],四川省,成都市,,生活服务;物流速递;物流速递
103.744515,30.395009,四川宏祥大道物流有限公司,中合街22附3附近,四川省,成都市,,生活服务;物流速递;物流速递
103.912422,30.380743,成都市欣发物流有限公司,[],四川省,成都市,,生活服务;物流速递;物流速递
103.895210,30.402465,成都市茂盛物流有限公司,凤凌街与龙翔街交叉路口西南侧,四川省,成都市,,生活服务;物流速递;物流速递
103.804760,30.427961,优速快递新津八部,兴园五路,四川省,成都市,,生活服务;物流速递;物流速递
103.803979,30.428899,成都锐特物流有限公司(三合),希望西路125号附近,四川省,成都市,,生活服务;物流速递;物流速递
103.921599,30.384899,成都市新津龙盛物流有限公司,养廉街,四川省,成都市,,生活服务;物流速递;物流速递
103.920476,30.381360,四川国储天府物流园区,物流园邓家寺北路13号,四川省,成都市,,生活服务;物流速递;物流仓储场地
103.914760,30.384117,四川亚成物流有限责任公司,普兴镇火车站,四川省,成都市,,生活服务;生活服务场所;生活服务场所
103.781951,30.474599,成都到九江运通物流有限公司,万和村万和物流园8幢9号库,四川省,成都市,,生活服务;物流速递;物流速递
103.847983,30.431105,成都盛世诚运物流有限公司,长绍街,四川省,成都市,,生活服务;物流速递;物流速递
103.899980,30.377399,成都万申冷链物流有限公司,金华镇清云北路399号,四川省,成都市,,生活服务;物流速递;物流速递
103.918339,30.388404,成都顺丰源物流有限公司,普兴镇邓家寺北路5号附23号,四川省,成都市,,生活服务;物流速递;物流速递
103.806808,30.425625,成都顺展鸿途物流有限公司,兴园五路,四川省,成都市,,生活服务;物流速递;物流速递
103.914715,30.371750,东百集团成都新津物流中心,金华镇西新大道688号,四川省,成都市,,生活服务;物流速递;物流速递
103.731177,30.424926,韵达快递收件取件点,方兴街40附1号附近,四川省,成都市,,生活服务;物流速递;物流速递
103.924088,30.386263,成都市新骥物流有限公司,中储粮背后商铺200米,四川省,成都市,,生活服务;物流速递;物流速递
103.901696,30.399837,四川汇津现代物流股份有限公司,普兴大道西段1号,四川省,成都市,,生活服务;物流速递;物流速递
103.922297,30.381083,四川国储天府物流有限公司,物流园邓家寺北路13号,四川省,成都市,,生活服务;物流速递;物流速递
103.915741,30.370989,龙地东百新津物流园,西新大道,四川省,成都市,,生活服务;物流速递;物流仓储场地
103.923971,30.386306,成都顺丰源物流有限公司,[],四川省,成都市,,生活服务;物流速递;物流速递
103.816925,30.405468,成都市楠峰物流有限公司,五河路7附11号附近,四川省,成都市,,生活服务;物流速递;物流速递
103.804550,30.411892,丰巢快递柜,五津镇海林西巷22,四川省,成都市,五津街道,生活服务;物流速递;物流速递
103.819732,30.420895,丰巢快递柜,水井街与瑞安路交叉路口东北侧(翡翠湾-二期),四川省,成都市,五津街道,生活服务;物流速递;物流速递
103.782070,30.476257,万和物流园农作物仓储配送,成新蒲快速路(万和物流园),四川省,成都市,,生活服务;物流速递;物流速递
103.901465,30.400073,汇津物流园招商中心,[],四川省,成都市,,生活服务;生活服务场所;生活服务场所
103.743721,30.394242,成都川祥通物流有限公司,中合街,四川省,成都市,,生活服务;物流速递;物流速递
103.743749,30.394138,成都迅时捷宇吉物流有限公司,中合街与新邛公路交叉口西北50米,四川省,成都市,,生活服务;物流速递;物流速递
103.886825,30.377789,百世快运金华普兴营业部,宝清路33号,四川省,成都市,,生活服务;物流速递;物流速递
103.783163,30.475023,潮客物流安徽全直达,万和村万和物流园,四川省,成都市,,生活服务;物流速递;物流速递
103.924174,30.386277,建洪货运代理营销部,[],四川省,成都市,,生活服务;物流速递;物流速递
103.811365,30.426737,德邦(新津营业部),五津镇希望大道125-129号,四川省,成都市,,生活服务;物流速递;物流速递
103.914791,30.371907,顺丰成都快运中转场,熊家埂,四川省,成都市,,生活服务;物流速递;物流速递
103.908580,30.375371,苏宁家乐福(中国西区物流中心),"龙溪河北路318,388号(砖桥村)",四川省,成都市,,生活服务;物流速递;物流仓储场地
103.924923,30.386525,重庆志骏物流有限公司驻成都办事处,大黄路北100米,四川省,成都市,,生活服务;物流速递;物流速递
103.782478,30.458550,咸鱼公社新津快递共配服务中心(吴店子店),[],四川省,成都市,,生活服务;物流速递;物流速递
103.806850,30.418044,新津快递共配服务中心(水城嘉瑞店),水城嘉瑞,四川省,成都市,五津街道,生活服务;物流速递;物流速递
103.816253,30.408068,咸鱼公社新津快递共配服务中心(南桥新天地店),[],四川省,成都市,五津街道,生活服务;物流速递;物流速递
103.803904,30.428869,建国货运(兴园5路),兴园5路419附15-17号,四川省,成都市,,生活服务;物流速递;物流速递
103.855826,30.443486,京东(花源配送站点),成都市新津区仁和街47号,四川省,成都市,,生活服务;物流速递;物流速递
103.786885,30.413982,宅急送(新津营业厅),新平镇劳动街112号,四川省,成都市,,生活服务;物流速递;物流速递
103.885826,30.380518,新津中通,金华镇银杏路48号,四川省,成都市,,生活服务;物流速递;物流速递
103.833613,30.388582,德邦(岷江大道营业部),岷江大道三段67号,四川省,成都市,,生活服务;物流速递;物流速递
103.895884,30.380072,德邦,金华镇亿邦机电城,四川省,成都市,,生活服务;物流速递;物流速递
103.803527,30.425900,韵达,平岗路332号334号,四川省,成都市,,生活服务;物流速递;物流速递
103.804434,30.427851,顺丰速运(兴园5路),兴园5路,四川省,成都市,,生活服务;物流速递;物流速递
103.887920,30.485526,菜鸟驿站(金秋乐园店),花源镇白云路295号金秋乐园白云大道295号,四川省,成都市,花源街道,生活服务;物流速递;物流速递
103.811267,30.484844,快邮驿站,[],四川省,成都市,,生活服务;物流速递;物流速递
103.855821,30.443473,京东成都花源营业部,成都市新津县花桥镇仁和街43号,四川省,成都市,,生活服务;物流速递;物流速递
103.811287,30.485107,菜鸟驿站,兴义镇兴盛街131号,四川省,成都市,,生活服务;物流速递;物流速递
103.854365,30.446752,妈妈驿站,政通街,四川省,成都市,,生活服务;物流速递;物流速递
103.920352,30.383255,普兴分拨中心,养廉街,四川省,成都市,,生活服务;物流速递;物流速递
103.899658,30.405291,妈妈驿站,普兴东街(新津县普兴初中西南侧约100米),四川省,成都市,,生活服务;物流速递;物流速递
103.900452,30.396858,顺丰速运,[],四川省,成都市,,生活服务;物流速递;物流速递
103.755412,30.489855,耀户饲料配送中心,帅公馆街与文井西巷交叉路口西侧,四川省,成都市,,生活服务;物流速递;物流速递
103.805594,30.426798,OK Express UNION,[],四川省,成都市,,生活服务;物流速递;物流速递
103.780932,30.460068,酒席配送,吴店街与新文路交叉路口西侧,四川省,成都市,,生活服务;生活服务场所;生活服务场所
103.796913,30.427299,新津秋华食品,五津镇儒林路576号,四川省,成都市,,生活服务;物流速递;物流速递
103.814458,30.439874,韵达新津区服务站,至兴园6路80号,四川省,成都市,,生活服务;物流速递;物流速递
103.866870,30.384099,菜鸟驿站,黄津路(岳店社区西侧),四川省,成都市,,生活服务;物流速递;物流速递
103.804479,30.421681,普通货运信息配载,平岗路(欧郡南侧约100米),四川省,成都市,五津街道,生活服务;物流速递;物流速递
103.748890,30.491735,成都弘发货运有限公司,XA3851,四川省,成都市,,生活服务;物流速递;物流速递
103.833129,30.388221,壹米滴答,岷江大道三段58号附近,四川省,成都市,,生活服务;物流速递;物流速递
103.805231,30.426378,顺心捷达新津五津店,兴园五路337号附16-17号,四川省,成都市,,生活服务;物流速递;物流速递
103.785422,30.412600,妈妈驿站,京昆线,四川省,成都市,新平,生活服务;物流速递;物流速递
103.800533,30.416817,良伟货运部,扁担街16号附近,四川省,成都市,五津街道,生活服务;物流速递;物流速递
103.751060,30.395399,菜鸟驿站(安西镇店),安西镇安西街80号时尚造型对面菜鸟驿站,四川省,成都市,,生活服务;物流速递;物流速递
103.885030,30.478668,菜鸟驿站(成职院创业街),花源大道310号成都职业技术学院花源校区,四川省,成都市,花源街道,生活服务;物流速递;物流速递
103.882355,30.486661,菜鸟驿站(白云路4号店),花源街道白云路4号,四川省,成都市,花源街道,生活服务;物流速递;物流速递
103.797980,30.424971,韵达EXPRESS园区代理点,儒林路,四川省,成都市,五津街道,生活服务;物流速递;物流速递
103.854436,30.446760,菜鸟驿站(政通街83号店),政通街83号,四川省,成都市,,生活服务;物流速递;物流速递
103.804666,30.427815,壹米滴答新津安西营业部,五津街道古家村3组34号,四川省,成都市,,生活服务;物流速递;物流速递
103.804825,30.407360,新津区生态鲜奶配送中心,文昌路34附近,四川省,成都市,,生活服务;物流速递;物流速递
103.854713,30.444612,中国体育彩票,花桥镇中学路7号,四川省,成都市,,生活服务;物流速递;物流速递|生活服务;彩票彩券销售点;彩票彩券销售点
103.920530,30.382924,普兴铁路货场,普兴镇,四川省,成都市,,生活服务;物流速递;物流仓储场地
103.883720,30.487769,菜鸟驿站,花源镇白云大道115号,四川省,成都市,花源街道,生活服务;物流速递;物流速递
103.744940,30.341130,菜鸟驿站,永商镇和平街63号,四川省,成都市,,生活服务;物流速递;物流速递
103.804271,30.428887,马帮传奇·盛世前程,兴园五路与希望西路交叉路口往南约100米,四川省,成都市,,生活服务;物流速递;物流速递
103.860172,30.446394,菜鸟驿站(金桥街177号店),金桥街177号,四川省,成都市,,生活服务;物流速递;物流速递
103.885834,30.380540,菜鸟驿站(银杏路124号店),普兴街道银杏路124号,四川省,成都市,,生活服务;物流速递;物流速递
103.816241,30.424931,壹米滴答,瑞通路229号附近,四川省,成都市,,生活服务;物流速递;物流速递|购物服务;购物相关场所;购物相关场所
103.883282,30.480227,菜鸟驿站(竹苑大道47号店),花源街道竹苑大道47号菜鸟驿站,四川省,成都市,花源街道,生活服务;物流速递;物流速递
103.881308,30.464912,菜鸟驿站(金科廊桥水乡店),花源街道兴普大道241号,四川省,成都市,,生活服务;物流速递;物流速递
103.915459,30.394745,天府新区公路货物集散中心,新普路附近,四川省,成都市,,生活服务;物流速递;物流速递
103.806474,30.426312,菜鸟驿站(成都颐和雅郡店),五津街道兴园五路176号,四川省,成都市,,生活服务;物流速递;物流速递
103.804580,30.428781,新津县三志配送服务部代办,兴园5路附近,四川省,成都市,,生活服务;物流速递;物流速递
103.879395,30.497256,菜鸟驿站(花园老街201号店),花源街道花园老街201号(梦璐旁边),四川省,成都市,,生活服务;物流速递;物流速递
103.887842,30.486975,菜鸟驿站(成艺大学后校门店),白云大道与花源大道交叉路口东侧(金秋乐园西北侧),四川省,成都市,花源街道,生活服务;物流速递;物流速递
103.888502,30.486764,顺丰速运,花源镇龙翔四街32号,四川省,成都市,花源街道,生活服务;生活服务场所;生活服务场所
103.808457,30.426936,新津诚兴食品配送,温州路148附近,四川省,成都市,,生活服务;物流速递;物流速递
103.917520,30.382376,普兴货运站,养廉街(普兴站东侧约150米),四川省,成都市,,生活服务;生活服务场所;生活服务场所
103.814535,30.483002,兴义配送中心,三新路114号附近,四川省,成都市,,生活服务;生活服务场所;生活服务场所
103.808383,30.426958,惠盈配送中心,五津镇内温州路148号,四川省,成都市,,生活服务;生活服务场所;生活服务场所
103.857861,30.446853,双茂配送中心,长绍街171附134附近,四川省,成都市,,生活服务;生活服务场所;生活服务场所|购物服务;购物相关场所;购物相关场所
103.821829,30.423045,菜鸟驿站(成都新津海悦豪庭店),五津街道瑞东路102号海悦豪庭一期,四川省,成都市,,生活服务;物流速递;物流速递
103.815750,30.432250,菜鸟驿站(成都新筑鼎峰15栋店),五津街道新筑鼎峰后大门15栋1单元,四川省,成都市,,生活服务;物流速递;物流速递
103.835890,30.382490,菜鸟驿站(成都新津罗山新居店),"邓双镇岷山大道三段366号,罗山新居小区",四川省,成都市,,生活服务;物流速递;物流速递
103.814102,30.419829,菜鸟驿站(成都新津九龙公寓店),瑞园路149号-附1附近,四川省,成都市,五津街道,生活服务;物流速递;物流速递
103.868420,30.384290,菜鸟驿站(成都新津岳店小区店),金华镇岳店小区,四川省,成都市,,生活服务;物流速递;物流速递
103.824619,30.392280,菜鸟驿站(成都新津芝芝花园店),邓双镇芝芝路路8号成都农商银行旁,四川省,成都市,,生活服务;物流速递;物流速递
103.798275,30.413406,菜鸟驿站(成都新津江山多娇店),五津街道西顺河街398号江山多娇86栋三单元物业服务中心,四川省,成都市,,生活服务;物流速递;物流速递
103.898340,30.406806,久酒粮配送,普兴西街14号附近,四川省,成都市,,生活服务;生活服务场所;生活服务场所
103.900200,30.377554,中国沃尔玛生鲜配送中心,[],四川省,成都市,,生活服务;物流速递;物流速递
103.835460,30.418730,菜鸟驿站(成都新津棉花沱小区店),花桥镇棉花沱北路81号,四川省,成都市,,生活服务;物流速递;物流速递
103.837029,30.421512,菜鸟驿站(成都新津棉花沱小区店),棉花沱北路(棉花沱社区),四川省,成都市,,生活服务;物流速递;物流速递
103.911410,30.380820,菜鸟驿站(成都新津养瑞苑小区店),普兴镇养信街养瑞苑小区六栋二单元101室,四川省,成都市,,生活服务;物流速递;物流速递
103.750165,30.395492,菜鸟驿站(成都新津安西街80号店),安西街,四川省,成都市,,生活服务;物流速递;物流速递
103.757630,30.487630,菜鸟驿站(成都新津文井街152号店),文井乡文井街152号(文井乡卫生院对面),四川省,成都市,,生活服务;物流速递;物流速递
103.882757,30.484175,菜鸟驿站(花源街道宜兴茶楼95号店),花源街道府西路95号,四川省,成都市,花源街道,生活服务;物流速递;物流速递
103.885149,30.406093,菜鸟驿站(成都新津天府城邦四期店),普兴镇骑龙湖三路恒大天府城邦四期34栋底商107号,四川省,成都市,,生活服务;物流速递;物流速递
103.891570,30.403429,菜鸟驿站(成都新津恒大天府城邦店),成都市新津县普兴镇骑龙湖三路323,四川省,成都市,,生活服务;物流速递;物流速递
103.801277,30.407779,菜鸟驿站(成都新津望江安置小区店),永商镇望滨路111号,四川省,成都市,,生活服务;物流速递;物流速递
103.887480,30.486060,菜鸟驿站(成都新津花源龙祥路8号店),花源镇龙祥路8号,四川省,成都市,花源街道,生活服务;物流速递;物流速递
103.882340,30.478890,菜鸟驿站(成都职业技术学院花源校区),花源镇成都职业技术学院创业街菜鸟驿站,四川省,成都市,花源街道,生活服务;物流速递;物流速递
103.812013,30.435623,菜鸟驿站(成都新津龙王渡二期13栋店),五津街道兴园三路龙王渡二期13栋1单元1号,四川省,成都市,,生活服务;物流速递;物流速递
103.812096,30.484186,菜鸟驿站(成都新津兴义斑竹林183号店),兴义镇斑竹林街183号,四川省,成都市,,生活服务;物流速递;物流速递
103.894540,30.410200,菜鸟驿站(成都普兴镇安置房5期10栋店),普兴镇普兴西街42附2号,四川省,成都市,,生活服务;物流速递;物流速递
103.805185,30.482264,菜鸟驿站(成都新津兴义歇马店街95号店),兴义镇歇马店街95号,四川省,成都市,,生活服务;物流速递;物流速递
103.887299,30.380267,菜鸟驿站(成都新津金华镇宝峰路23号店),金华镇宝峰路23号店,四川省,成都市,,生活服务;物流速递;物流速递
103.818230,30.428235,菜鸟驿站(成都新津隆鑫印象城邦正门店),五津街道兴园3路6号隆鑫印象城邦,四川省,成都市,,生活服务;物流速递;物流速递
103.882810,30.476610,菜鸟驿站(成都新津柳河苑2栋1单元1号店),花源镇兴普大道柳河苑,四川省,成都市,花源街道,生活服务;物流速递;物流速递
103.883257,30.474807,菜鸟驿站(成都新津优博淘花源商业广场店),花源镇柳河村优博淘华源1-123,四川省,成都市,,生活服务;物流速递;物流速递
103.811610,30.426324,成都新津红祥汽车运输有限公司,五津镇希望路111号,四川省,成都市,五津街道,生活服务;物流速递;物流速递
103.804889,30.419162,华美配送,平岗路和谐商务旅馆旁,四川省,成都市,五津街道,生活服务;生活服务场所;生活服务场所
103.919906,30.382998,铁路货运(新津货运站营业厅),普兴镇养正养方街新津站东300米,四川省,成都市,,生活服务;物流速递;物流速递
103.478469,30.403907,邮政速递物流公司(邛崃市分公司),东星大道453号,四川省,成都市,临邛,生活服务;邮局;邮政速递
103.477816,30.403981,邛崃市邮政局,东星大道443号,四川省,成都市,临邛,生活服务;邮局;邮局
103.477619,30.404002,中国邮政集团公司(邛崃市分公司),东星大道443号,四川省,成都市,临邛,公司企业;公司;公司
103.350722,30.413211,中国邮政包裹快递代收点,马湖街,四川省,成都市,,生活服务;邮局;邮政速递
103.336071,30.342415,邛崃市平乐邮政支局,迎宾大道226号附近,四川省,成都市,,生活服务;邮局;邮局
103.698101,30.398244,中国邮政,黄塔街,四川省,成都市,,生活服务;邮局;邮局
103.635241,30.376028,中国邮政,正街(高埂中学东北侧约50米),四川省,成都市,,生活服务;邮局;邮局
103.419040,30.335340,中国邮政,金龙街与龙潭街交叉路口西北侧,四川省,成都市,,生活服务;邮局;邮局
103.339365,30.500633,邛崃市大同邮政代办所,大同乡富民街86号,四川省,成都市,,生活服务;邮局;邮局
103.450922,30.477985,中国邮政便民服务站,桑园大桥,四川省,成都市,,生活服务;邮局;邮局
103.504413,30.381382,邛崃市宝林邮政代办所,宝塔社区桥南街113号,四川省,成都市,,生活服务;邮局;邮局
103.671344,30.353323,邛崃市牟礼邮政代办所,新建街377号,四川省,成都市,牟礼村,生活服务;邮局;邮局
103.158867,30.323640,邛崃市高何邮政代办所,高何镇上天街96号,四川省,成都市,,生活服务;邮局;邮局
103.419912,30.522789,邛崃市茶园邮政代办所,茶园乡茶西路111号,四川省,成都市,,生活服务;邮局;邮局
103.180832,30.408820,邛崃市南宝邮政代办所,南宝乡南宝街12号,四川省,成都市,,生活服务;邮局;邮局
103.260033,30.402601,邛崃市油榨邮政代办所,南宝山镇桃花社区新街81号附2号,四川省,成都市,,生活服务;邮局;邮局
103.686023,30.304313,邛崃市回龙邮政代办所,回龙镇正街64号,四川省,成都市,,生活服务;邮局;邮局
103.287668,30.312206,邛崃市道佐邮政代办所,道佐乡东街45号,四川省,成都市,,生活服务;邮局;邮局
103.584094,30.387735,邛崃市固驿邮政代办所,卷洞桥街201附近,四川省,成都市,固驿街道,生活服务;邮局;邮局
103.291106,30.264407,邛崃市临济邮政代办所,临济镇临济街12号,四川省,成都市,临济,生活服务;邮局;邮局
103.496299,30.452615,邛崃市君平邮政代办所,桑园镇童桥街114号,四川省,成都市,,生活服务;邮局;邮局
103.454491,30.389360,邛崃市南河邮政代办所,临邛镇大东街120号,四川省,成都市,临邛,生活服务;邮局;邮局
103.668623,30.348404,中国邮政便民服务站,新建街,四川省,成都市,牟礼村,生活服务;生活服务场所;生活服务场所
103.444907,30.384941,中国邮政便民服务站,[],四川省,成都市,,生活服务;生活服务场所;生活服务场所
103.174883,30.301876,中国邮政便民服务站,寿高路,四川省,成都市,,生活服务;生活服务场所;生活服务场所
103.451620,30.442006,中国邮政便民服务站,[],四川省,成都市,,生活服务;生活服务场所;生活服务场所
103.673800,30.352123,中国邮政便民服务站,和平街,四川省,成都市,牟礼村,生活服务;生活服务场所;生活服务场所
103.349625,30.411517,中国邮政便民服务站,马湖街,四川省,成都市,,生活服务;生活服务场所;生活服务场所
103.155397,30.241230,中国邮政村邮站,[],四川省,成都市,,生活服务;生活服务场所;生活服务场所
103.414245,30.376797,邛崃市孔明邮政代办所,太阳社区6组,四川省,成都市,,生活服务;邮局;邮局
103.350705,30.413181,邛崃市马湖邮政代办所,水口镇马湖街123号,四川省,成都市,,生活服务;邮局;邮局
103.712257,30.342045,邛崃市永丰邮政代办所,牟礼镇永丰正街54号,四川省,成都市,,生活服务;邮局;邮局
103.350644,30.379583,中国邮政便民服务部,下坝北街与平乐镇东街交叉路口往西北约150米,四川省,成都市,,生活服务;生活服务场所;生活服务场所
103.478396,30.403952,中国邮政(邛崃市东星邮政支局),东星大道453号,四川省,成都市,临邛,生活服务;邮局;邮政速递
103.459968,30.412347,邛崃市南岳街邮政支局,南岳街43号,四川省,成都市,临邛,生活服务;邮局;邮局
103.651531,30.347627,邛崃市新迎街邮政支局,牟礼镇兴贤新果街131-133号,四川省,成都市,,生活服务;邮局;邮局
